{
  "$schema":"https://json-schema.org/draft/2020-12/schema","$id":"https://hunteval.dev/schemas/v0.9/retrieval-audit-event.schema.json","title":"HuntEval retrieval audit event v0.9","type":"object","additionalProperties":false,
  "required":["schema_version","sequence","recorded_at","scope","query_sha256","result_sha256","index_sha256","latency_ms","cost_microunits","previous_event_sha256"],"properties":{"schema_version":{"const":"0.9"},"sequence":{"type":"integer","minimum":1},"recorded_at":{"type":"string","format":"date-time","pattern":"Z$"},"scope":{"$ref":"common.schema.json#/$defs/scope"},"query_sha256":{"$ref":"common.schema.json#/$defs/sha256"},"result_sha256":{"$ref":"common.schema.json#/$defs/sha256"},"index_sha256":{"$ref":"common.schema.json#/$defs/sha256"},"latency_ms":{"type":"integer","minimum":0},"cost_microunits":{"oneOf":[{"type":"null"},{"type":"integer","minimum":0}]},"previous_event_sha256":{"oneOf":[{"type":"null"},{"$ref":"common.schema.json#/$defs/sha256"}]}}
}
