{"schema_version":"0.9","sequence":1,"recorded_at":"2026-08-10T00:00:00Z","scope":"evaluator_analytics","query_sha256":"a5df485ce4b65764c837a15a3cc95bd94cce38e98155aab05eec91f55eb6627e","result_sha256":"916ef90edad07771b75e920ad233723a4e3fbd149250dc493cd5e7c40a6ab676","index_sha256":"35800841d6623cffa85c7ae2258c9abbe8e58a4d01af96e05ecbc7808f958cbb","latency_ms":4,"cost_microunits":null,"previous_event_sha256":null}
